{
  "$schema": "https://json-schema.org/draft/2020-12/schema",
  "$id": "https://portable-toolkit.local/schemas/site-profile.schema.json",
  "title": "Portable Astro + Cloudflare Site Profile",
  "type": "object",
  "required": [
    "siteId",
    "projectRoot",
    "deployTarget",
    "zone",
    "hosts",
    "commands",
    "cloudflare"
  ],
  "properties": {
    "siteId": {
      "type": "string",
      "minLength": 1
    },
    "projectRoot": {
      "type": "string",
      "minLength": 1,
      "description": "Project root path. Relative paths are resolved from the profile file location and are preferred for portability."
    },
    "deployTarget": {
      "enum": [
        "workers",
        "pages"
      ]
    },
    "metadata": {
      "type": "object",
      "properties": {
        "registrar": {
          "type": "string"
        },
        "dnsProvider": {
          "type": "string"
        },
        "emailEnabled": {
          "type": "boolean"
        },
        "emailProvider": {
          "type": "string"
        },
        "notes": {
          "type": "array",
          "items": {
            "type": "string"
          }
        }
      },
      "additionalProperties": true
    },
    "zone": {
      "type": "object",
      "required": [
        "name"
      ],
      "properties": {
        "name": {
          "type": "string",
          "minLength": 1
        },
        "expectedNameservers": {
          "type": "array",
          "items": {
            "type": "string"
          }
        }
      },
      "additionalProperties": true
    },
    "hosts": {
      "type": "object",
      "required": [
        "production"
      ],
      "properties": {
        "production": {
          "type": "array",
          "minItems": 1,
          "items": {
            "type": "string"
          }
        },
        "development": {
          "type": "array",
          "minItems": 0,
          "items": {
            "type": "string"
          },
          "default": []
        }
      },
      "additionalProperties": true
    },
    "commands": {
      "type": "object",
      "required": [
        "install",
        "check",
        "build"
      ],
      "properties": {
        "install": {
          "type": "string"
        },
        "check": {
          "type": "string"
        },
        "build": {
          "type": "string"
        },
        "preview": {
          "type": "string"
        },
        "tests": {
          "type": "array",
          "items": {
            "type": "string"
          }
        },
        "deploy": {
          "type": "object",
          "properties": {
            "development": {
              "type": "string"
            },
            "production": {
              "type": "string"
            }
          },
          "additionalProperties": true
        }
      },
      "additionalProperties": true
    },
    "instagram": {
      "type": "object",
      "description": "Optional public Instagram handle for instagram-clone and portfolio galleries.",
      "properties": {
        "username": {
          "type": "string",
          "description": "Instagram handle without @. Prefer INSTAGRAM_USERNAME in project .env for recyclability."
        },
        "cloneLimit": {
          "type": "integer",
          "minimum": 1,
          "default": 24,
          "description": "Max posts for instagram-clone (overridden by INSTAGRAM_CLONE_LIMIT in .env)."
        }
      },
      "additionalProperties": true
    },
    "sourcing": {
      "type": "object",
      "properties": {
        "type": {
          "enum": [
            "wordpress",
            "wix",
            "squarespace"
          ]
        },
        "url": {
          "type": "string"
        },
        "includeMedia": {
          "type": "boolean",
          "default": true
        },
        "apiRoot": {
          "type": "string",
          "description": "Optional override for REST API root."
        },
        "delayMs": {
          "type": "integer",
          "minimum": 0,
          "default": 900,
          "description": "Delay between public Wix page fetches to avoid connection resets."
        },
        "maxPages": {
          "type": "integer",
          "minimum": 1,
          "description": "Max paginated shop listing pages per shop path."
        },
        "maxProducts": {
          "type": "integer",
          "minimum": 1,
          "description": "Optional cap on harvested product slugs (debug / smoke)."
        },
        "shopPath": {
          "type": "string",
          "description": "Single Wix shop listing path. Prefer shopPaths when both / and /shop exist."
        },
        "shopPaths": {
          "type": "array",
          "items": { "type": "string" },
          "description": "Wix listing paths to paginate. Default: [\"/\", \"/shop\"]."
        },
        "productPathPrefix": {
          "type": "string",
          "default": "/product-page/",
          "description": "Public Wix product URL prefix."
        },
        "rebuildProductPath": {
          "type": "string",
          "default": "/product/",
          "description": "Target rebuild path prefix written into URLMap and catalog."
        },
        "writeCatalog": {
          "type": "string",
          "default": "src/data/catalog.json",
          "description": "Project-relative path for the Wix catalog JSON snapshot."
        },
        "phone": {
          "type": "string",
          "description": "Optional contact phone. Otherwise harvested from public page text."
        },
        "pages": {
          "type": "array",
          "description": "Optional static Wix paths to harvest as pages. Default tries /faq and /contact.",
          "items": {
            "type": "object",
            "properties": {
              "path": { "type": "string" },
              "slug": { "type": "string" },
              "title": { "type": "string" },
              "excerpt": { "type": "string" },
              "rebuildPath": { "type": "string" }
            },
            "required": ["path"]
          }
        },
        "categoryRules": {
          "type": "array",
          "description": "Client-specific product taxonomy. Each pattern is a JS regex source.",
          "items": {
            "type": "object",
            "properties": {
              "category": { "type": "string" },
              "pattern": { "type": "string" },
              "flags": { "type": "string", "default": "i" }
            },
            "required": ["category", "pattern"]
          }
        },
        "defaultCategory": {
          "type": "string",
          "default": "Uncategorized"
        }
      },
      "additionalProperties": true
    },
    "diagnostics": {
      "type": "object",
      "properties": {
        "discovery": {
          "type": "object",
          "description": "Discovery Doctor policy. Core discovery artifacts are required by default; explicitly set a requirement to false to relax it or add endpoints for a stricter public contract.",
          "properties": {
            "environment": {
              "enum": ["production", "development"]
            },
            "required": {
              "type": "object",
              "properties": {
                "robots": { "type": "boolean" },
                "sitemap": { "type": "boolean" },
                "llms": { "type": "boolean" },
                "llmsFull": { "type": "boolean" },
                "contentApi": { "type": "boolean" },
                "searchApi": { "type": "boolean" },
                "humans": { "type": "boolean" },
                "securityTxt": { "type": "boolean" },
                "headers": { "type": "boolean" },
                "jsonLd": { "type": "boolean" }
              },
              "additionalProperties": true
            },
            "sitemapCandidates": {
              "type": "array",
              "items": { "type": "string", "minLength": 1 }
            },
            "endpoints": {
              "type": "array",
              "items": {
                "type": "object",
                "required": ["path"],
                "properties": {
                  "path": { "type": "string", "minLength": 1 },
                  "label": { "type": "string" },
                  "method": { "enum": ["GET", "POST", "HEAD"] },
                  "format": { "enum": ["text", "json", "xml", "llms", "security", "mcp"] },
                  "required": { "type": "boolean" },
                  "runtimeOnly": { "type": "boolean" },
                  "ssrOk": { "type": "boolean" },
                  "checkLinks": { "type": "boolean" },
                  "schema": { "enum": ["object", "array", "envelope"] },
                  "protocolVersion": { "type": "string" }
                },
                "additionalProperties": true
              }
            },
            "checkLinks": { "type": "boolean" },
            "maxLinks": { "type": "integer", "minimum": 1, "maximum": 200 },
            "timeoutMs": { "type": "integer", "minimum": 1, "maximum": 60000 },
            "mcpProtocolVersion": { "type": "string" },
            "privatePathSegments": {
              "type": "array",
              "items": { "type": "string" }
            }
          },
          "additionalProperties": true
        },
        "qualitySmoke": {
          "type": "object",
          "properties": {
            "routes": {
              "type": "array",
              "items": {
                "type": "string"
              }
            },
            "sitemapCandidates": {
              "type": "array",
              "items": {
                "type": "string"
              }
            },
            "assetSampleSize": {
              "type": "integer",
              "minimum": 1
            },
            "maxRootDurationMs": {
              "type": "integer",
              "minimum": 1
            },
            "maxRouteDurationMs": {
              "type": "integer",
              "minimum": 1
            },
            "privacyPaths": {
              "type": "array",
              "items": {
                "type": "string"
              },
              "description": "Legal/privacy URL paths to probe (e.g. /privacy, /legal)."
            }
          },
          "additionalProperties": true
        },
        "browserDiagnostics": {
          "type": "object",
          "properties": {
            "routes": {
              "type": "array",
              "items": {
                "type": "string"
              }
            },
            "timeoutMs": {
              "type": "integer",
              "minimum": 1
            },
            "settleMs": {
              "type": "integer",
              "minimum": 0
            },
            "maxLoadMs": {
              "type": "integer",
              "minimum": 1
            },
            "maxFcpMs": {
              "type": "integer",
              "minimum": 1
            },
            "maxLcpMs": {
              "type": "integer",
              "minimum": 1
            },
            "maxCls": {
              "type": "number",
              "minimum": 0
            }
          },
          "additionalProperties": true
        },
        "wcagAuditor": {
          "type": "object",
          "description": "Evidence-oriented accessibility gate (Playwright + axe). Opt-in for site-doctor via enabled=true. Not a WCAG conformance certificate.",
          "properties": {
            "enabled": {
              "type": "boolean",
              "description": "When true, site-doctor run includes wcag-auditor."
            },
            "config": {
              "type": "string",
              "description": "Path to wcag-auditor.config.mjs relative to project root."
            },
            "routes": {
              "type": "array",
              "items": {
                "type": "string"
              },
              "description": "Scenario paths for profile-built or starter configs."
            },
            "baseURL": {
              "type": "string",
              "description": "Origin for Playwright scenarios (local preview or staging)."
            },
            "baseUrl": {
              "type": "string",
              "description": "Alias for baseURL."
            },
            "profile": {
              "type": "string",
              "description": "Reporting label only (e.g. wcag22-aa). Never a conformance claim."
            },
            "manageServer": {
              "type": "boolean",
              "description": "Start commands.preview (or previewCommand) for profile-built configs."
            },
            "previewCommand": {
              "type": "array",
              "items": {
                "type": "string"
              },
              "description": "Explicit argv for managed preview server, e.g. [\"npm\",\"run\",\"preview\"]."
            },
            "serverTimeoutMs": {
              "type": "integer",
              "minimum": 1
            }
          },
          "additionalProperties": true
        },
        "integrations": {
          "type": "object",
          "properties": {
            "analytics": {
              "type": "object"
            },
            "forms": {
              "type": "object"
            },
            "email": {
              "type": "object"
            },
            "auth": {
              "type": "object"
            }
          },
          "additionalProperties": true
        }
      },
      "additionalProperties": true
    },
    "branding": {
      "type": "object",
      "properties": {
        "colors": {
          "type": "object",
          "properties": {
            "background": {
              "type": "string",
              "default": "#08080d"
            },
            "accent": {
              "type": "string",
              "default": "#c45142"
            },
            "text_primary": {
              "type": "string",
              "default": "#ffffff"
            },
            "text_secondary": {
              "type": "string",
              "default": "#a0a0b0"
            },
            "glow": {
              "type": "string",
              "default": "#c45142"
            }
          },
          "additionalProperties": true
        },
        "typography": {
          "type": "object",
          "properties": {
            "title_font": {
              "type": "object",
              "properties": {
                "path": {
                  "type": "string"
                },
                "size": {
                  "type": "integer",
                  "default": 100
                }
              }
            },
            "body_font": {
              "type": "object",
              "properties": {
                "path": {
                  "type": "string"
                },
                "size": {
                  "type": "integer",
                  "default": 36
                }
              }
            },
            "eyebrow_font": {
              "type": "object",
              "properties": {
                "path": {
                  "type": "string"
                },
                "size": {
                  "type": "integer",
                  "default": 34
                }
              }
            },
            "subtitle_font": {
              "type": "object",
              "properties": {
                "path": {
                  "type": "string"
                },
                "size": {
                  "type": "integer",
                  "default": 32
                }
              }
            }
          },
          "additionalProperties": true
        },
        "visuals": {
          "type": "object",
          "properties": {
            "og_layout": {
              "enum": [
                "master-polish-5.5",
                "minimal"
              ],
              "default": "master-polish-5.5"
            },
            "signature_enabled": {
              "type": "boolean",
              "default": true
            },
            "signature_delimiter": {
              "type": "string",
              "default": "|"
            },
            "signature_offset_px": {
              "type": "integer",
              "default": 1
            },
            "glow_passes": {
              "type": "integer",
              "default": 5
            },
            "aurora_enabled": {
              "type": "boolean",
              "default": true
            },
            "aurora_blur": {
              "type": "integer",
              "default": 160
            },
            "noise_intensity": {
              "type": "number",
              "default": 0.005
            },
            "portrait_blur_radius": {
              "type": "integer",
              "default": 1
            }
          },
          "additionalProperties": true
        },
        "assets": {
          "type": "object",
          "properties": {
            "logo": {
              "type": "string"
            },
            "portrait": {
              "type": "string"
            },
            "favicon_source": {
              "type": "string"
            }
          },
          "additionalProperties": true
        }
      },
      "additionalProperties": true
    },
    "cloudflare": {
      "type": "object",
      "properties": {
        "workerNames": {
          "type": "object",
          "properties": {
            "production": {
              "type": "string"
            },
            "development": {
              "type": "string"
            }
          },
          "additionalProperties": true
        },
        "account": {
          "type": "object",
          "properties": {
            "name": {
              "type": "string"
            },
            "id": {
              "type": "string"
            }
          },
          "additionalProperties": true
        },
        "pagesProject": {
          "type": "string"
        },
        "resourceConfig": {
          "type": "string"
        },
        "devResourceConfig": {
          "type": "string"
        },
        "routes": {
          "type": "object"
        },
        "dns": {
          "type": "object"
        },
        "crawlPolicy": {
          "type": "object"
        },
        "cachePurge": {
          "type": "object"
        },
        "headers": {
          "type": "object",
          "properties": {
            "distSubdir": {
              "type": "string",
              "description": "Subdirectory under dist/ where static assets and _headers are written (e.g. client for Astro Workers adapter)."
            },
            "preset": {
              "enum": [
                "astro-static",
                "astro-analytics"
              ]
            },
            "developmentNoIndex": {
              "type": "boolean"
            },
            "hstsMaxAge": {
              "type": "number"
            },
            "includeSubdomains": {
              "type": "boolean"
            },
            "preloadHsts": {
              "type": "boolean"
            },
            "ogImagePath": {
              "type": "string"
            },
            "csp": {
              "type": "object",
              "properties": {
                "directives": {
                  "type": "object"
                }
              },
              "additionalProperties": true
            }
          },
          "additionalProperties": true
        }
      },
      "additionalProperties": true
    }
  },
  "additionalProperties": true
}
